[
  {
    "date": "2026-06-04",
    "title": "Fix: \"There's an issue with the selected model (deepseek-v4-pro)\" in Claude CLI",
    "link": "https://dev.to/couimet/fix-theres-an-issue-with-the-selected-model-deepseek-v4-pro-in-claude-cli-44jg",
    "anchor": "deepseek-model-not-found"
  },
  {
    "date": "2026-05-21",
    "title": "I sold you on /scratchpad. Then I migrated to /note.",
    "link": "https://dev.to/couimet/i-sold-you-on-scratchpad-then-i-migrated-to-note-4n1o",
    "anchor": "scratchpad-to-note",
    "projects": ["my-claude-skills"]
  },
  {
    "date": "2026-05-12",
    "title": "Eight env vars and Claude Code stops eating my paycheck",
    "link": "https://dev.to/couimet/eight-env-vars-and-claude-code-stops-eating-my-paycheck-2659",
    "anchor": "deepseek-claude-code"
  },
  {
    "date": "2026-04-21",
    "title": "I thought I was DRY-ing. I may have been double-paying.",
    "link": "https://dev.to/couimet/i-thought-i-was-dry-ing-i-may-have-been-double-paying-5dli",
    "anchor": "dry-ing-double-paying",
    "projects": ["my-claude-skills"]
  },
  {
    "date": "2026-03-16",
    "title": "From Vide Coding to Supercharged Vibe Guiding",
    "link": "https://dev.to/couimet/from-vide-coding-to-supercharged-vibe-guiding-6nm",
    "anchor": "vibe-guiding",
    "projects": ["my-claude-skills"]
  },
  {
    "date": "2025-12-16",
    "title": "RangeLink v1.0.0: Perfected AI Workflows + The R-Keybinding Family",
    "link": "https://dev.to/couimet/rangelink-v100-perfected-ai-workflows-the-r-keybinding-family-104b",
    "anchor": "rangelink-v1",
    "projects": ["rangelink-extension"]
  },
  {
    "date": "2025-11-12",
    "title": "RangeLink v0.3.0: One Keybinding to Rule Them All",
    "link": "https://dev.to/couimet/rangelink-v030-one-keybinding-to-rule-them-all-2h01",
    "anchor": "rangelink-v03",
    "projects": ["rangelink-extension"]
  },
  {
    "date": "2025-11-08",
    "title": "I Built a VS Code Extension to Stop the Copy-Paste Madness",
    "link": "https://dev.to/couimet/i-built-a-vs-code-extension-to-stop-the-copy-paste-madness-3d7l",
    "anchor": "copy-paste-madness",
    "projects": ["rangelink-extension"]
  }
]
